{"schema":"youi.gaps/v1","generatedAt":"2026-10-22T21:55:19.082Z","system":"Demo","discover":"not-synced","kit":["button","input","card","badge","dialog","alert","drawer","menu","popover","tooltip","tabs","avatar","accordion","table","carousel","slider","switch","checkbox","radio","select","otp","progress","skeleton","spinner","sidebar","navigation","breadcrumb","pagination","command","toast","date-picker","combobox","chart"],"projects":[{"id":"console","complete":true,"dependencies":"read","concepts":[{"concept":"badge","name":"badge","status":"hand-built","system":[],"packages":[],"definitions":[{"name":"Badge","file":"src/components/legacy/badge.tsx","line":4},{"name":"Badge","file":"src/components/ui/badge.tsx","line":16},{"name":".lg-badge","file":"src/styles/legacy.css","line":21}],"count":3,"uses":2,"files":5,"candidates":null},{"concept":"alert","name":"alert","status":"missing","system":[],"packages":[],"definitions":[],"count":0,"uses":0,"files":0,"candidates":null},{"concept":"drawer","name":"drawer","status":"missing","system":[],"packages":[],"definitions":[],"count":0,"uses":0,"files":0,"candidates":null},{"concept":"menu","name":"dropdown menu","status":"missing","system":[],"packages":[],"definitions":[],"count":0,"uses":0,"files":0,"candidates":null},{"concept":"popover","name":"popover","status":"missing","system":[],"packages":[],"definitions":[],"count":0,"uses":0,"files":0,"candidates":null},{"concept":"tooltip","name":"tooltip","status":"missing","system":[],"packages":[],"definitions":[],"count":0,"uses":0,"files":0,"candidates":null},{"concept":"avatar","name":"avatar","status":"missing","system":[],"packages":[],"definitions":[],"count":0,"uses":0,"files":0,"candidates":null},{"concept":"accordion","name":"accordion","status":"missing","system":[],"packages":[],"definitions":[],"count":0,"uses":0,"files":0,"candidates":null},{"concept":"table","name":"data table","status":"missing","system":[],"packages":[],"definitions":[],"count":0,"uses":0,"files":0,"candidates":null},{"concept":"carousel","name":"carousel","status":"missing","system":[],"packages":[],"definitions":[],"count":0,"uses":0,"files":0,"candidates":null},{"concept":"slider","name":"slider","status":"missing","system":[],"packages":[],"definitions":[],"count":0,"uses":0,"files":0,"candidates":null},{"concept":"switch","name":"switch","status":"missing","system":[],"packages":[],"definitions":[],"count":0,"uses":0,"files":0,"candidates":null},{"concept":"checkbox","name":"checkbox","status":"missing","system":[],"packages":[],"definitions":[],"count":0,"uses":0,"files":0,"candidates":null},{"concept":"radio","name":"radio group","status":"missing","system":[],"packages":[],"definitions":[],"count":0,"uses":0,"files":0,"candidates":null},{"concept":"select","name":"select","status":"missing","system":[],"packages":[],"definitions":[],"count":0,"uses":0,"files":0,"candidates":null},{"concept":"otp","name":"otp","status":"missing","system":[],"packages":[],"definitions":[],"count":0,"uses":0,"files":0,"candidates":null},{"concept":"progress","name":"progress","status":"missing","system":[],"packages":[],"definitions":[],"count":0,"uses":0,"files":0,"candidates":null},{"concept":"skeleton","name":"skeleton","status":"missing","system":[],"packages":[],"definitions":[],"count":0,"uses":0,"files":0,"candidates":null},{"concept":"spinner","name":"spinner","status":"missing","system":[],"packages":[],"definitions":[],"count":0,"uses":0,"files":0,"candidates":null},{"concept":"sidebar","name":"sidebar","status":"missing","system":[],"packages":[],"definitions":[],"count":0,"uses":0,"files":0,"candidates":null},{"concept":"navigation","name":"navigation menu","status":"missing","system":[],"packages":[],"definitions":[],"count":0,"uses":0,"files":0,"candidates":null},{"concept":"breadcrumb","name":"breadcrumb","status":"missing","system":[],"packages":[],"definitions":[],"count":0,"uses":0,"files":0,"candidates":null},{"concept":"pagination","name":"pagination","status":"missing","system":[],"packages":[],"definitions":[],"count":0,"uses":0,"files":0,"candidates":null},{"concept":"command","name":"command palette","status":"missing","system":[],"packages":[],"definitions":[],"count":0,"uses":0,"files":0,"candidates":null},{"concept":"toast","name":"toast","status":"missing","system":[],"packages":[],"definitions":[],"count":0,"uses":0,"files":0,"candidates":null},{"concept":"date-picker","name":"date picker","status":"missing","system":[],"packages":[],"definitions":[],"count":0,"uses":0,"files":0,"candidates":null},{"concept":"combobox","name":"combobox","status":"missing","system":[],"packages":[],"definitions":[],"count":0,"uses":0,"files":0,"candidates":null},{"concept":"chart","name":"chart","status":"missing","system":[],"packages":[],"definitions":[],"count":0,"uses":0,"files":0,"candidates":null},{"concept":"dialog","name":"dialog","status":"library","system":[],"packages":["@radix-ui/react-dialog"],"definitions":[{"name":"Dialog","file":"src/components/ui/dialog.tsx","line":5}],"count":1,"uses":1,"files":2,"candidates":[]},{"concept":"tabs","name":"tabs","status":"library","system":[],"packages":["@radix-ui/react-tabs"],"definitions":[{"name":"Tabs","file":"src/components/ui/tabs.tsx","line":5}],"count":1,"uses":1,"files":2,"candidates":[]},{"concept":"button","name":"button","status":"system","system":["Button"],"packages":[],"definitions":[{"name":".ui-button","file":"src/browser/ui.css","line":3},{"name":"LegacyButton","file":"src/components/legacy/legacy-button.tsx","line":3},{"name":"LegacyIconButton","file":"src/components/legacy/legacy-button.tsx","line":7},{"name":"Button","file":"src/components/ui/button.tsx","line":24},{"name":".lg-button","file":"src/styles/legacy.css","line":3}],"count":5,"uses":15,"files":9,"candidates":[]},{"concept":"input","name":"input","status":"system","system":["Input"],"packages":[],"definitions":[{"name":".ui-input","file":"src/browser/ui.css","line":12},{"name":"Input","file":"src/components/ui/input.tsx","line":4}],"count":2,"uses":2,"files":4,"candidates":[]},{"concept":"card","name":"card","status":"system","system":["Card"],"packages":[],"definitions":[{"name":"Card","file":"src/components/ui/card.tsx","line":4}],"count":1,"uses":1,"files":2,"candidates":[]}]},{"id":"site","complete":true,"dependencies":"read","concepts":[{"concept":"badge","name":"badge","status":"hand-built","system":[],"packages":[],"definitions":[{"name":"Badge","file":"src/components/ui/Badge.astro","line":1},{"name":".ui-badge","file":"src/styles/ui.css","line":34}],"count":2,"uses":1,"files":3,"candidates":null},{"concept":"tabs","name":"tabs","status":"hand-built","system":[],"packages":[],"definitions":[{"name":".ui-tabs","file":"src/styles/ui.css","line":49}],"count":1,"uses":1,"files":2,"candidates":null},{"concept":"dialog","name":"dialog","status":"missing","system":[],"packages":[],"definitions":[],"count":0,"uses":0,"files":0,"candidates":null},{"concept":"alert","name":"alert","status":"missing","system":[],"packages":[],"definitions":[],"count":0,"uses":0,"files":0,"candidates":null},{"concept":"drawer","name":"drawer","status":"missing","system":[],"packages":[],"definitions":[],"count":0,"uses":0,"files":0,"candidates":null},{"concept":"menu","name":"dropdown menu","status":"missing","system":[],"packages":[],"definitions":[],"count":0,"uses":0,"files":0,"candidates":null},{"concept":"popover","name":"popover","status":"missing","system":[],"packages":[],"definitions":[],"count":0,"uses":0,"files":0,"candidates":null},{"concept":"tooltip","name":"tooltip","status":"missing","system":[],"packages":[],"definitions":[],"count":0,"uses":0,"files":0,"candidates":null},{"concept":"avatar","name":"avatar","status":"missing","system":[],"packages":[],"definitions":[],"count":0,"uses":0,"files":0,"candidates":null},{"concept":"accordion","name":"accordion","status":"missing","system":[],"packages":[],"definitions":[],"count":0,"uses":0,"files":0,"candidates":null},{"concept":"table","name":"data table","status":"missing","system":[],"packages":[],"definitions":[],"count":0,"uses":0,"files":0,"candidates":null},{"concept":"carousel","name":"carousel","status":"missing","system":[],"packages":[],"definitions":[],"count":0,"uses":0,"files":0,"candidates":null},{"concept":"slider","name":"slider","status":"missing","system":[],"packages":[],"definitions":[],"count":0,"uses":0,"files":0,"candidates":null},{"concept":"switch","name":"switch","status":"missing","system":[],"packages":[],"definitions":[],"count":0,"uses":0,"files":0,"candidates":null},{"concept":"checkbox","name":"checkbox","status":"missing","system":[],"packages":[],"definitions":[],"count":0,"uses":0,"files":0,"candidates":null},{"concept":"radio","name":"radio group","status":"missing","system":[],"packages":[],"definitions":[],"count":0,"uses":0,"files":0,"candidates":null},{"concept":"select","name":"select","status":"missing","system":[],"packages":[],"definitions":[],"count":0,"uses":0,"files":0,"candidates":null},{"concept":"otp","name":"otp","status":"missing","system":[],"packages":[],"definitions":[],"count":0,"uses":0,"files":0,"candidates":null},{"concept":"progress","name":"progress","status":"missing","system":[],"packages":[],"definitions":[],"count":0,"uses":0,"files":0,"candidates":null},{"concept":"skeleton","name":"skeleton","status":"missing","system":[],"packages":[],"definitions":[],"count":0,"uses":0,"files":0,"candidates":null},{"concept":"spinner","name":"spinner","status":"missing","system":[],"packages":[],"definitions":[],"count":0,"uses":0,"files":0,"candidates":null},{"concept":"sidebar","name":"sidebar","status":"missing","system":[],"packages":[],"definitions":[],"count":0,"uses":0,"files":0,"candidates":null},{"concept":"navigation","name":"navigation menu","status":"missing","system":[],"packages":[],"definitions":[],"count":0,"uses":0,"files":0,"candidates":null},{"concept":"breadcrumb","name":"breadcrumb","s